id,title,author,subject,description
195,The Dawn of Everything,David Graeber,History,A new history of humanity that challenges everything we thought we knew about the origins of civilization
196,Entanglements,Kim TallBear,Library Science,How indigenous data sovereignty and community-based research can reshape knowledge production
197,The Pleasure of Finding Things Out,Richard Feynman,Science,A collection of short works by Feynman on science curiosity and the joy of discovery
198,When We Cease to Understand the World,Benjamin Labatut,Fiction,Fictionalized accounts of scientists whose discoveries pushed them to the edge of madness
199,The Midnight Library,Matt Haig,Fiction,A woman discovers a library between life and death where each book represents a life she could have lived
200,Tomorrow and Tomorrow and Tomorrow,Gabrielle Zevin,Fiction,Two friends build a video game empire over decades navigating creativity love and the meaning of success
